18:12:39.466184 IP 192.168.202.51.34372 > 192.168.203.255.58581: UDP, length 128
18:12:39.568846 ARP, Request who-has 192.168.202.50 tell 192.168.202.71, length 46
18:12:39.568848 IP 192.168.202.71.mdns > mdns.mcast.net.mdns: 0 A (QM)? npic4b175.local. (33)
18:12:39.670910 IP 192.168.202.234.mdns > mdns.mcast.net.mdns: 0 PTR (QM)? d.d.2.b.b.a.d.3.8.3.3.d.7.2.4.6.0.0.0.0.0.0.0.0.0.0.0.0.0.8.e.f.ip6.arpa. (90)
18:12:39.670941 IP 192.168.202.217.49961 > 192.168.203.255.58581: UDP, length 125
18:12:39.773095 ARP, Request who-has 192.168.203.43 (Broadcast) tell 192.168.203.43, length 46
18:12:39.875175 IP 192.168.202.247.mdns > mdns.mcast.net.mdns: 3 [3q] PTR (QM)? _%9E5E7C8F47989526C9BCD95D24084F6F0B27C5ED._sub._googlecast._tcp.local. PTR (QM)? _CFE7FEDA._sub._googlecast._tcp.local. PTR (QM)? _googlecast._tcp.local. (110)
18:12:39.888272 IP aravind-thinkpad-e15-gen-4.41320 > 52.123.173.174.https: Flags [P.], seq 2781101826:2781101883, ack 4140990780, win 501, length 57
18:12:39.987320 IP 192.168.202.67.36449 > 192.168.203.255.58581: UDP, length 140
18:12:39.987325 IP 192.168.202.51.34372 > 192.168.203.255.58581: UDP, length 128
18:12:40.086745 IP 52.123.173.174.https > aravind-thinkpad-e15-gen-4.41320: Flags [P.], seq 1:47, ack 57, win 2048, length 46
18:12:40.086793 IP aravind-thinkpad-e15-gen-4.41320 > 52.123.173.174.https: Flags [.], ack 47, win 501, length 0
18:12:40.182591 IP 192.168.202.217.49961 > 192.168.203.255.58581: UDP, length 125
18:12:40.376210 IP aravind-thinkpad-e15-gen-4.46359 > dns.google.domain: 34780+ [1au] PTR? 255.203.168.192.in-addr.arpa. (57)
18:12:40.392017 IP dns.google.domain > aravind-thinkpad-e15-gen-4.46359: 34780 NXDomain 0/0/1 (57)
18:12:40.392017 ARP, Request who-has 192.168.202.124 tell 192.168.202.5, length 46
18:12:40.392283 IP aravind-thinkpad-e15-gen-4.46359 > dns.google.domain: 34780+ PTR? 255.203.168.192.in-addr.arpa. (46)
18:12:40.406517 IP dns.google.domain > aravind-thinkpad-e15-gen-4.46359: 34780 NXDomain 0/0/0 (46)
18:12:40.407688 IP aravind-thinkpad-e15-gen-4.59129 > dns.google.domain: 64794+ [1au] PTR? 51.202.168.192.in-addr.arpa. (56)
18:12:40.427293 IP dns.google.domain > aravind-thinkpad-e15-gen-4.59129: 64794 NXDomain 0/0/1 (56)
18:12:40.427554 IP aravind-thinkpad-e15-gen-4.59129 > dns.google.domain: 64794+ PTR? 51.202.168.192.in-addr.arpa. (45)
18:12:40.447721 IP dns.google.domain > aravind-thinkpad-e15-gen-4.59129: 64794 NXDomain 0/0/0 (45)
18:12:40.448869 IP aravind-thinkpad-e15-gen-4.57757 > dns.google.domain: 32333+ [1au] PTR? 50.202.168.192.in-addr.arpa. (56)
18:12:40.465476 IP dns.google.domain > aravind-thinkpad-e15-gen-4.57757: 32333 NXDomain 0/0/1 (56)
18:12:40.465759 IP aravind-thinkpad-e15-gen-4.57757 > dns.google.domain: 32333+ PTR? 50.202.168.192.in-addr.arpa. (45)
18:12:40.480399 IP dns.google.domain > aravind-thinkpad-e15-gen-4.57757: 32333 NXDomain 0/0/0 (45)
18:12:40.481120 IP aravind-thinkpad-e15-gen-4.60884 > dns.google.domain: 65386+ [1au] PTR? 71.202.168.192.in-addr.arpa. (56)
18:12:40.499276 IP 192.168.202.67.36449 > 192.168.203.255.58581: UDP, length 140
18:12:40.499278 IP 192.168.202.51.34372 > 192.168.203.255.58581: UDP, length 128
18:12:40.501430 IP dns.google.domain > aravind-thinkpad-e15-gen-4.60884: 65386 NXDomain 0/0/1 (56)
18:12:40.501921 IP aravind-thinkpad-e15-gen-4.60884 > dns.google.domain: 65386+ PTR? 71.202.168.192.in-addr.arpa. (45)
18:12:40.520709 IP dns.google.domain > aravind-thinkpad-e15-gen-4.60884: 65386 NXDomain 0/0/0 (45)
18:12:40.522951 IP aravind-thinkpad-e15-gen-4.59168 > dns.google.domain: 50755+ [1au] PTR? 234.202.168.192.in-addr.arpa. (57)
18:12:40.537965 IP dns.google.domain > aravind-thinkpad-e15-gen-4.59168: 50755 NXDomain 0/0/1 (57)
18:12:40.538209 IP aravind-thinkpad-e15-gen-4.59168 > dns.google.domain: 50755+ PTR? 234.202.168.192.in-addr.arpa. (46)
18:12:40.552605 IP dns.google.domain > aravind-thinkpad-e15-gen-4.59168: 50755 NXDomain 0/0/0 (46)
18:12:40.553691 IP aravind-thinkpad-e15-gen-4.55644 > dns.google.domain: 4242+ [1au] PTR? 217.202.168.192.in-addr.arpa. (57)
18:12:40.568692 IP dns.google.domain > aravind-thinkpad-e15-gen-4.55644: 4242 NXDomain 0/0/1 (57)
18:12:40.569004 IP aravind-thinkpad-e15-gen-4.55644 > dns.google.domain: 4242+ PTR? 217.202.168.192.in-addr.arpa. (46)
18:12:40.583083 IP dns.google.domain > aravind-thinkpad-e15-gen-4.55644: 4242 NXDomain 0/0/0 (46)
18:12:40.584607 IP aravind-thinkpad-e15-gen-4.53751 > dns.google.domain: 23561+ [1au] PTR? 43.203.168.192.in-addr.arpa. (56)
18:12:40.600013 IP6 fe80::7019:2eff:fe46:8605.mdns > ff02::fb.mdns: 867 PTR (QM)? _spotify-social-listening._tcp.local. (54)
18:12:40.600030 IP dns.google.domain > aravind-thinkpad-e15-gen-4.53751: 23561 NXDomain 0/0/1 (56)
18:12:40.600034 ARP, Request who-has _gateway tell 192.168.202.67, length 46
18:12:40.600274 IP aravind-thinkpad-e15-gen-4.53751 > dns.google.domain: 23561+ PTR? 43.203.168.192.in-addr.arpa. (45)
18:12:40.616336 IP dns.google.domain > aravind-thinkpad-e15-gen-4.53751: 23561 NXDomain 0/0/0 (45)
18:12:40.618060 IP aravind-thinkpad-e15-gen-4.38321 > dns.google.domain: 50698+ [1au] PTR? 247.202.168.192.in-addr.arpa. (57)
18:12:40.633797 IP dns.google.domain > aravind-thinkpad-e15-gen-4.38321: 50698 NXDomain 0/0/1 (57)
18:12:40.634155 IP aravind-thinkpad-e15-gen-4.38321 > dns.google.domain: 50698+ PTR? 247.202.168.192.in-addr.arpa. (46)
18:12:40.649583 IP dns.google.domain > aravind-thinkpad-e15-gen-4.38321: 50698 NXDomain 0/0/0 (46)
18:12:40.651082 IP aravind-thinkpad-e15-gen-4.51231 > dns.google.domain: 31942+ [1au] PTR? 174.173.123.52.in-addr.arpa. (56)
18:12:40.671589 IP dns.google.domain > aravind-thinkpad-e15-gen-4.51231: 31942 NXDomain 0/1/1 (142)
18:12:40.671938 IP aravind-thinkpad-e15-gen-4.51231 > dns.google.domain: 31942+ PTR? 174.173.123.52.in-addr.arpa. (45)
18:12:40.691611 IP dns.google.domain > aravind-thinkpad-e15-gen-4.51231: 31942 NXDomain 0/1/0 (131)
18:12:40.693388 IP aravind-thinkpad-e15-gen-4.49568 > dns.google.domain: 23217+ [1au] PTR? 235.203.168.192.in-addr.arpa. (57)
18:12:40.694460 IP 192.168.202.217.49961 > 192.168.203.255.58581: UDP, length 125
18:12:40.694472 ARP, Request who-has 192.168.203.43 (Broadcast) tell 192.168.203.43, length 46
18:12:40.709966 IP dns.google.domain > aravind-thinkpad-e15-gen-4.49568: 23217 NXDomain 0/0/1 (57)
18:12:40.710389 IP aravind-thinkpad-e15-gen-4.49568 > dns.google.domain: 23217+ PTR? 235.203.168.192.in-addr.arpa. (46)
18:12:40.725638 IP dns.google.domain > aravind-thinkpad-e15-gen-4.49568: 23217 NXDomain 0/0/0 (46)
18:12:40.726959 IP aravind-thinkpad-e15-gen-4.50645 > dns.google.domain: 58773+ [1au] PTR? 67.202.168.192.in-addr.arpa. (56)
18:12:40.742436 IP dns.google.domain > aravind-thinkpad-e15-gen-4.50645: 58773 NXDomain 0/0/1 (56)
18:12:40.742777 IP aravind-thinkpad-e15-gen-4.50645 > dns.google.domain: 58773+ PTR? 67.202.168.192.in-addr.arpa. (45)
18:12:40.757363 IP dns.google.domain > aravind-thinkpad-e15-gen-4.50645: 58773 NXDomain 0/0/0 (45)
18:12:41.002264 IP 192.168.202.51.34372 > 192.168.203.255.58581: UDP, length 128
18:12:41.105226 IP 192.168.202.138.mdns > mdns.mcast.net.mdns: 0 A (QM)? WIN-DMD7GGVAOEU.local. (39)
18:12:41.105229 IP 192.168.202.138.mdns > mdns.mcast.net.mdns: 0 AAAA (QM)? WIN-DMD7GGVAOEU.local. (39)
18:12:41.105249 IP6 fe80::9e35:596c:6a36:e06e.mdns > ff02::fb.mdns: 0 A (QM)? WIN-DMD7GGVAOEU.local. (39)
18:12:41.105252 IP6 fe80::9e35:596c:6a36:e06e.mdns > ff02::fb.mdns: 0 AAAA (QM)? WIN-DMD7GGVAOEU.local. (39)
18:12:41.209367 IP 192.168.202.234.mdns > mdns.mcast.net.mdns: 0 PTR (QU)? e.6.0.e.6.3.a.6.c.6.9.5.5.3.e.9.0.0.0.0.0.0.0.0.0.0.0.0.0.8.e.f.ip6.arpa. (90)
18:12:41.209415 IP 192.168.202.217.49961 > 192.168.203.255.58581: UDP, length 125
18:12:41.209421 IP 192.168.202.71.mdns > mdns.mcast.net.mdns: 0 A (QM)? NPIC4B175.local. (33)
18:12:41.209424 IP 192.168.202.71.mdns > mdns.mcast.net.mdns: 0 AAAA (QM)? npic4b175.local. (33)
18:12:41.209434 IP6 fe80::6427:d338:3dab:b2dd.mdns > ff02::fb.mdns: 0 AAAA (QM)? npic4b175.local. (33)
18:12:41.400212 IP aravind-thinkpad-e15-gen-4.53383 > dns.google.domain: 29149+ [1au] PTR? 124.202.168.192.in-addr.arpa. (57)
18:12:41.415142 IP 192.168.202.5.mdns > mdns.mcast.net.mdns: 2 [3q] PTR (QM)? _%9E5E7C8F47989526C9BCD95D24084F6F0B27C5ED._sub._googlecast._tcp.local. PTR (QM)? _CFE7FEDA._sub._googlecast._tcp.local. PTR (QM)? _googlecast._tcp.local. (110)
18:12:41.421751 IP dns.google.domain > aravind-thinkpad-e15-gen-4.53383: 29149 NXDomain 0/0/1 (57)
18:12:41.422070 IP aravind-thinkpad-e15-gen-4.53383 > dns.google.domain: 29149+ PTR? 124.202.168.192.in-addr.arpa. (46)
18:12:41.441346 IP dns.google.domain > aravind-thinkpad-e15-gen-4.53383: 29149 NXDomain 0/0/0 (46)
18:12:41.443024 IP aravind-thinkpad-e15-gen-4.57997 > dns.google.domain: 43659+ [1au] PTR? 5.202.168.192.in-addr.arpa. (55)
18:12:41.458494 IP dns.google.domain > aravind-thinkpad-e15-gen-4.57997: 43659 NXDomain 0/0/1 (55)
18:12:41.458806 IP aravind-thinkpad-e15-gen-4.57997 > dns.google.domain: 43659+ PTR? 5.202.168.192.in-addr.arpa. (44)
18:12:41.474210 IP dns.google.domain > aravind-thinkpad-e15-gen-4.57997: 43659 NXDomain 0/0/0 (44)
18:12:41.475750 IP aravind-thinkpad-e15-gen-4.46809 > dns.google.domain: 59094+ [1au] PTR? b.f.0.0.0.0.0.0.0.0.0.0.0.0.0.0.0.0.0.0.0.0.0.0.0.0.0.0.2.0.f.f.ip6.arpa. (101)
18:12:41.516471 IP dns.google.domain > aravind-thinkpad-e15-gen-4.46809: 59094 NXDomain 0/1/1 (165)
18:12:41.516471 IP 192.168.202.138.netbios-ns > 192.168.203.255.netbios-ns: UDP, length 50
18:12:41.516473 IP 192.168.202.253.36323 > 192.168.203.255.58581: UDP, length 115
18:12:41.516492 IP 192.168.202.51.34372 > 192.168.203.255.58581: UDP, length 128
18:12:41.516731 IP aravind-thinkpad-e15-gen-4.46809 > dns.google.domain: 59094+ PTR? b.f.0.0.0.0.0.0.0.0.0.0.0.0.0.0.0.0.0.0.0.0.0.0.0.0.0.0.2.0.f.f.ip6.arpa. (90)
18:12:41.532533 IP dns.google.domain > aravind-thinkpad-e15-gen-4.46809: 59094 NXDomain 0/1/0 (154)
18:12:41.534563 IP aravind-thinkpad-e15-gen-4.60427 > dns.google.domain: 35431+ [1au] PTR? 5.0.6.8.6.4.e.f.f.f.e.2.9.1.0.7.0.0.0.0.0.0.0.0.0.0.0.0.0.8.e.f.ip6.arpa. (101)
18:12:41.565918 IP dns.google.domain > aravind-thinkpad-e15-gen-4.60427: 35431 NXDomain 0/1/1 (165)
18:12:41.566169 IP aravind-thinkpad-e15-gen-4.60427 > dns.google.domain: 35431+ PTR? 5.0.6.8.6.4.e.f.f.f.e.2.9.1.0.7.0.0.0.0.0.0.0.0.0.0.0.0.0.8.e.f.ip6.arpa. (90)
18:12:41.580338 IP dns.google.domain > aravind-thinkpad-e15-gen-4.60427: 35431 NXDomain 0/1/0 (154)
18:12:41.581994 IP aravind-thinkpad-e15-gen-4.42002 > dns.google.domain: 63528+ [1au] PTR? 1.202.168.192.in-addr.arpa. (55)
18:12:41.595822 IP dns.google.domain > aravind-thinkpad-e15-gen-4.42002: 63528 NXDomain 0/0/1 (55)
18:12:41.596151 IP aravind-thinkpad-e15-gen-4.42002 > dns.google.domain: 63528+ PTR? 1.202.168.192.in-addr.arpa. (44)
18:12:41.609857 IP dns.google.domain > aravind-thinkpad-e15-gen-4.42002: 63528 NXDomain 0/0/0 (44)
18:12:41.611179 IP aravind-thinkpad-e15-gen-4.35343 > dns.google.domain: 8288+ [1au] PTR? 138.202.168.192.in-addr.arpa. (57)
18:12:41.625859 IP 192.168.202.71.netbios-ns > 192.168.203.255.netbios-ns: UDP, length 50
18:12:41.625861 IP 192.168.202.71.netbios-ns > 192.168.203.255.netbios-ns: UDP, length 50
18:12:41.626649 IP dns.google.domain > aravind-thinkpad-e15-gen-4.35343: 8288 NXDomain 0/0/1 (57)
18:12:41.626851 IP aravind-thinkpad-e15-gen-4.35343 > dns.google.domain: 8288+ PTR? 138.202.168.192.in-addr.arpa. (46)
18:12:41.641866 IP dns.google.domain > aravind-thinkpad-e15-gen-4.35343: 8288 NXDomain 0/0/0 (46)
18:12:41.643527 IP aravind-thinkpad-e15-gen-4.40948 > dns.google.domain: 35225+ [1au] PTR? e.6.0.e.6.3.a.6.c.6.9.5.5.3.e.9.0.0.0.0.0.0.0.0.0.0.0.0.0.8.e.f.ip6.arpa. (101)
18:12:41.676594 IP dns.google.domain > aravind-thinkpad-e15-gen-4.40948: 35225 NXDomain 0/1/1 (165)
18:12:41.676865 IP aravind-thinkpad-e15-gen-4.40948 > dns.google.domain: 35225+ PTR? e.6.0.e.6.3.a.6.c.6.9.5.5.3.e.9.0.0.0.0.0.0.0.0.0.0.0.0.0.8.e.f.ip6.arpa. (90)
18:12:41.713018 IP dns.google.domain > aravind-thinkpad-e15-gen-4.40948: 35225 NXDomain 0/1/0 (154)
18:12:41.714688 IP aravind-thinkpad-e15-gen-4.44735 > dns.google.domain: 19134+ [1au] PTR? d.d.2.b.b.a.d.3.8.3.3.d.7.2.4.6.0.0.0.0.0.0.0.0.0.0.0.0.0.8.e.f.ip6.arpa. (101)
18:12:41.722842 IP 192.168.203.34.mdns > mdns.mcast.net.mdns: 0 ANY (QM)? Mos-Com-11098.local. (37)
18:12:41.722844 IP 192.168.203.34.mdns > mdns.mcast.net.mdns: 0*- [0q] 2/0/0 AAAA fe80::5baf:d607:8fcf:206a, A 192.168.203.34 (75)
18:12:41.722844 IP 192.168.203.34.mdns > mdns.mcast.net.mdns: 0 ANY (QM)? Mos-Com-11098.local. (37)
18:12:41.722845 IP 192.168.203.34.mdns > mdns.mcast.net.mdns: 0*- [0q] 2/0/0 AAAA fe80::5baf:d607:8fcf:206a, A 192.168.203.34 (75)
18:12:41.722845 IP 192.168.203.34.mdns > mdns.mcast.net.mdns: 0 ANY (QM)? Mos-Com-11098.local. (37)
18:12:41.722846 IP 192.168.203.34.mdns > mdns.mcast.net.mdns: 0*- [0q] 2/0/0 AAAA fe80::5baf:d607:8fcf:206a, A 192.168.203.34 (75)
18:12:41.722874 IP6 fe80::5baf:d607:8fcf:206a.mdns > ff02::fb.mdns: 0 ANY (QM)? Mos-Com-11098.local. (37)
18:12:41.722877 IP6 fe80::5baf:d607:8fcf:206a.mdns > ff02::fb.mdns: 0*- [0q] 2/0/0 AAAA fe80::5baf:d607:8fcf:206a, A 192.168.203.34 (75)
18:12:41.722878 IP6 fe80::5baf:d607:8fcf:206a.mdns > ff02::fb.mdns: 0*- [0q] 2/0/0 AAAA fe80::5baf:d607:8fcf:206a, A 192.168.203.34 (75)
18:12:41.746421 IP dns.google.domain > aravind-thinkpad-e15-gen-4.44735: 19134 NXDomain 0/1/1 (165)
18:12:41.746645 IP aravind-thinkpad-e15-gen-4.44735 > dns.google.domain: 19134+ PTR? d.d.2.b.b.a.d.3.8.3.3.d.7.2.4.6.0.0.0.0.0.0.0.0.0.0.0.0.0.8.e.f.ip6.arpa. (90)
18:12:41.777508 IP dns.google.domain > aravind-thinkpad-e15-gen-4.44735: 19134 NXDomain 0/1/0 (154)
18:12:41.803408 IP aravind-thinkpad-e15-gen-4.46009 > dns.google.domain: 27926+ [1au] A? outlook.office.com. (47)
18:12:41.803489 IP aravind-thinkpad-e15-gen-4.42032 > dns.google.domain: 10717+ [1au] AAAA? outlook.office.com. (47)
18:12:41.822001 IP 192.168.202.234.mdns > mdns.mcast.net.mdns: 0 PTR (QU)? a.6.0.2.f.c.f.8.7.0.6.d.f.a.b.5.0.0.0.0.0.0.0.0.0.0.0.0.0.8.e.f.ip6.arpa. (90)
18:12:41.822003 IP6 fe80::7019:2eff:fe46:8605.mdns > ff02::fb.mdns: 380 PTR (QM)? _spotify-social-listening._tcp.local. (54)
18:12:41.837134 IP dns.google.domain > aravind-thinkpad-e15-gen-4.46009: 27926 9/0/1 CNAME substrate.office.com., CNAME outlook.office365.com., CNAME ooc-g2.tm-4.office.com., CNAME outlook.ms-acdc.office.com., CNAME BOM-efz.ms-acdc.office.com., A 52.98.58.34, A 40.99.9.178, A 52.98.58.50, A 52.98.34.194 (245)
18:12:41.838299 IP dns.google.domain > aravind-thinkpad-e15-gen-4.42032: 10717 9/0/1 CNAME substrate.office.com., CNAME outlook.office365.com., CNAME ooc-g2.tm-4.office.com., CNAME outlook.ms-acdc.office.com., CNAME BOM-efz.ms-acdc.office.com., AAAA 2603:1046:c04:8a0::2, AAAA 2603:1046:c04:1016::2, AAAA 2603:1046:c04:80f::2, AAAA 2603:1046:c04:800::2 (293)
18:12:41.866541 IP aravind-thinkpad-e15-gen-4.46662 > 52.98.34.194.https: Flags [P.], seq 3310320795:3310323390, ack 2174205891, win 1317, options [nop,nop,TS val 1397661533 ecr 408520093], length 2595
18:12:41.867023 IP aravind-thinkpad-e15-gen-4.46662 > 52.98.34.194.https: Flags [P.], seq 2595:2626, ack 1, win 1317, options [nop,nop,TS val 1397661533 ecr 408520093], length 31
18:12:41.906442 IP 52.98.34.194.https > aravind-thinkpad-e15-gen-4.46662: Flags [.], ack 2626, win 16386, options [nop,nop,TS val 408530460 ecr 1397661533], length 0
18:12:41.932878 IP 192.168.202.131.mdns > mdns.mcast.net.mdns: 0 A (QM)? solsticedirectoryservice.local. (48)
18:12:41.932889 IP 192.168.202.67.36449 > 192.168.203.255.58581: UDP, length 140
18:12:42.006501 IP aravind-thinkpad-e15-gen-4.46592 > 162.247.243.29.https: Flags [.], seq 1037396306:1037397714, ack 2041370715, win 501, options [nop,nop,TS val 872960454 ecr 667119794], length 1408
18:12:42.035292 IP 192.168.202.253.36323 > 192.168.203.255.58581: UDP, length 115
18:12:42.131519 IP 192.168.202.234.mdns > mdns.mcast.net.mdns: 0 [3q] PTR (QM)? 6.6.c.0.c.1.3.9.0.3.4.4.4.3.0.f.0.0.0.0.0.0.0.0.0.0.0.0.0.8.e.f.ip6.arpa. PTR (QM)? d.d.2.b.b.a.d.3.8.3.3.d.7.2.4.6.0.0.0.0.0.0.0.0.0.0.0.0.0.8.e.f.ip6.arpa. PTR (QM)? e.6.0.e.6.3.a.6.c.6.9.5.5.3.e.9.0.0.0.0.0.0.0.0.0.0.0.0.0.8.e.f.ip6.arpa. (166)
18:12:42.131535 IP 192.168.202.138.mdns > mdns.mcast.net.mdns: 0 A (QM)? WIN-DMD7GGVAOEU.local. (39)
18:12:42.131538 IP 192.168.202.138.mdns > mdns.mcast.net.mdns: 0 AAAA (QM)? WIN-DMD7GGVAOEU.local. (39)
18:12:42.131542 IP 192.168.202.207.64448 > mdns.mcast.net.mdns: 0 TXT (QM)? Mos-com-10818._nomachine._tcp.local. (53)
18:12:42.131549 IP 192.168.202.131.mdns > mdns.mcast.net.mdns: 0 A (QM)? solsticediscoveryservice.local. (48)
18:12:42.131594 IP 52.98.34.194.https > aravind-thinkpad-e15-gen-4.46662: Flags [P.], seq 1:1357, ack 2626, win 16386, options [nop,nop,TS val 408530664 ecr 1397661533], length 1356
18:12:42.131595 IP 52.98.34.194.https > aravind-thinkpad-e15-gen-4.46662: Flags [P.], seq 1357:1388, ack 2626, win 16386, options [nop,nop,TS val 408530664 ecr 1397661533], length 31
18:12:42.131596 IP 52.98.34.194.https > aravind-thinkpad-e15-gen-4.46662: Flags [P.], seq 1388:1556, ack 2626, win 16386, options [nop,nop,TS val 408530669 ecr 1397661533], length 168
18:12:42.131628 IP aravind-thinkpad-e15-gen-4.46662 > 52.98.34.194.https: Flags [.], ack 1357, win 1340, options [nop,nop,TS val 1397661798 ecr 408530664], length 0
18:12:42.131656 IP aravind-thinkpad-e15-gen-4.46662 > 52.98.34.194.https: Flags [.], ack 1388, win 1340, options [nop,nop,TS val 1397661798 ecr 408530664], length 0
18:12:42.131664 IP aravind-thinkpad-e15-gen-4.46662 > 52.98.34.194.https: Flags [.], ack 1556, win 1363, options [nop,nop,TS val 1397661798 ecr 408530669], length 0
18:12:42.233562 IP 192.168.202.207.mdns > mdns.mcast.net.mdns: 0*- [0q] 1/0/0 (Cache flush) TXT "name=Mos-com-10818" "uuid=f32c8e5d-6aa7-4d4f-92b8-e1ae9678aef4" "type=NoMachine" "port=0" "OS=Windows 11" "HW=LENOVO 21JNS0AY00" "mac=60:45:2e:b7:1b:9b" "service=nx:4000" "ip=10.15.61.52;192.168.202.207;192.168.137.1;fe80::16bc:6339:e948:d60e;fe80::f584:4c00:a8d1:9d37" (312)
18:12:42.233577 IP 192.168.202.71.mdns > mdns.mcast.net.mdns: 0 A (QM)? NPIC4B175.local. (33)
18:12:42.233579 IP 192.168.202.71.mdns > mdns.mcast.net.mdns: 0 AAAA (QM)? NPIC4B175.local. (33)
18:12:42.233581 IP6 fe80::6427:d338:3dab:b2dd.mdns > ff02::fb.mdns: 0 A (QM)? NPIC4B175.local. (33)
18:12:42.233582 IP6 fe80::6427:d338:3dab:b2dd.mdns > ff02::fb.mdns: 0 AAAA (QM)? NPIC4B175.local. (33)
18:12:42.233583 IP 192.168.202.138.netbios-ns > 192.168.203.255.netbios-ns: UDP, length 50
18:12:42.333676 ARP, Request who-has _gateway tell 192.168.202.51, length 46
18:12:42.423324 IP aravind-thinkpad-e15-gen-4.57653 > dns.google.domain: 60274+ [1au] PTR? 253.202.168.192.in-addr.arpa. (57)
18:12:42.437846 IP 192.168.202.200.64758 > 192.168.203.255.1534: UDP, length 8
18:12:42.444439 IP dns.google.domain > aravind-thinkpad-e15-gen-4.57653: 60274 NXDomain 0/0/1 (57)
18:12:42.444791 IP aravind-thinkpad-e15-gen-4.57653 > dns.google.domain: 60274+ PTR? 253.202.168.192.in-addr.arpa. (46)
18:12:42.465613 IP dns.google.domain > aravind-thinkpad-e15-gen-4.57653: 60274 NXDomain 0/0/0 (46)
18:12:42.467397 IP aravind-thinkpad-e15-gen-4.52490 > dns.google.domain: 45725+ [1au] PTR? 34.203.168.192.in-addr.arpa. (56)
18:12:42.483438 IP dns.google.domain > aravind-thinkpad-e15-gen-4.52490: 45725 NXDomain 0/0/1 (56)
18:12:42.483779 IP aravind-thinkpad-e15-gen-4.52490 > dns.google.domain: 45725+ PTR? 34.203.168.192.in-addr.arpa. (45)
18:12:42.498814 IP dns.google.domain > aravind-thinkpad-e15-gen-4.52490: 45725 NXDomain 0/0/0 (45)
18:12:42.500611 IP aravind-thinkpad-e15-gen-4.40685 > dns.google.domain: 40237+ [1au] PTR? a.6.0.2.f.c.f.8.7.0.6.d.f.a.b.5.0.0.0.0.0.0.0.0.0.0.0.0.0.8.e.f.ip6.arpa. (101)
18:12:42.542821 IP 192.168.202.200.53930 > 192.168.203.255.1534: UDP, length 8
18:12:42.542876 IP dns.google.domain > aravind-thinkpad-e15-gen-4.40685: 40237 NXDomain 0/1/1 (165)
18:12:42.542947 ARP, Request who-has 192.168.202.50 tell 192.168.202.71, length 46
18:12:42.543287 IP aravind-thinkpad-e15-gen-4.40685 > dns.google.domain: 40237+ PTR? a.6.0.2.f.c.f.8.7.0.6.d.f.a.b.5.0.0.0.0.0.0.0.0.0.0.0.0.0.8.e.f.ip6.arpa. (90)
18:12:42.558043 IP dns.google.domain > aravind-thinkpad-e15-gen-4.40685: 40237 NXDomain 0/1/0 (154)
18:12:42.560219 IP aravind-thinkpad-e15-gen-4.60990 > dns.google.domain: 8857+ [1au] PTR? 194.34.98.52.in-addr.arpa. (54)
18:12:42.576689 IP dns.google.domain > aravind-thinkpad-e15-gen-4.60990: 8857 NXDomain 0/1/1 (140)
18:12:42.577032 IP aravind-thinkpad-e15-gen-4.60990 > dns.google.domain: 8857+ PTR? 194.34.98.52.in-addr.arpa. (43)
18:12:42.592459 IP dns.google.domain > aravind-thinkpad-e15-gen-4.60990: 8857 NXDomain 0/1/0 (129)
18:12:42.593984 IP aravind-thinkpad-e15-gen-4.49445 > dns.google.domain: 50355+ [1au] PTR? 131.202.168.192.in-addr.arpa. (57)
18:12:42.610718 IP dns.google.domain > aravind-thinkpad-e15-gen-4.49445: 50355 NXDomain 0/0/1 (57)
18:12:42.611001 IP aravind-thinkpad-e15-gen-4.49445 > dns.google.domain: 50355+ PTR? 131.202.168.192.in-addr.arpa. (46)
18:12:42.627782 IP dns.google.domain > aravind-thinkpad-e15-gen-4.49445: 50355 NXDomain 0/0/0 (46)
18:12:42.629328 IP aravind-thinkpad-e15-gen-4.44245 > dns.google.domain: 20472+ [1au] PTR? 29.243.247.162.in-addr.arpa. (56)
18:12:42.641508 ARP, Request who-has _gateway tell 192.168.202.67, length 46
18:12:42.645035 IP dns.google.domain > aravind-thinkpad-e15-gen-4.44245: 20472 NXDomain 0/1/1 (121)
18:12:42.645396 IP aravind-thinkpad-e15-gen-4.44245 > dns.google.domain: 20472+ PTR? 29.243.247.162.in-addr.arpa. (45)
18:12:42.662853 IP dns.google.domain > aravind-thinkpad-e15-gen-4.44245: 20472 NXDomain 0/1/0 (110)
18:12:42.664572 IP aravind-thinkpad-e15-gen-4.53215 > dns.google.domain: 46381+ [1au] PTR? 207.202.168.192.in-addr.arpa. (57)
18:12:42.679706 IP dns.google.domain > aravind-thinkpad-e15-gen-4.53215: 46381 NXDomain 0/0/1 (57)
18:12:42.680023 IP aravind-thinkpad-e15-gen-4.53215 > dns.google.domain: 46381+ PTR? 207.202.168.192.in-addr.arpa. (46)
18:12:42.696974 IP dns.google.domain > aravind-thinkpad-e15-gen-4.53215: 46381 NXDomain 0/0/0 (46)
18:12:42.743285 IP 0.0.0.0.bootpc > 255.255.255.255.bootps: BOOTP/DHCP, Request from 7c:21:4a:43:d9:1a (oui Unknown), length 324
18:12:42.847599 IP 192.168.202.234.mdns > mdns.mcast.net.mdns: 0 PTR (QM)? a.6.0.2.f.c.f.8.7.0.6.d.f.a.b.5.0.0.0.0.0.0.0.0.0.0.0.0.0.8.e.f.ip6.arpa. (90)
18:12:42.847635 ARP, Request who-has 192.168.203.244 tell 0.0.0.0, length 46
18:12:42.847637 IP 192.168.202.207.64448 > mdns.mcast.net.mdns: 0 [2q] TXT (QM)? Mos-com-10818._nomachine._tcp.local. PTR (QM)? _nomachine._tcp.local. (59)
18:12:42.847646 IP6 fe80::cf5:b30:4324:f4bc.mdns > ff02::fb.mdns: 0 PTR (QM)? a.6.0.2.f.c.f.8.7.0.6.d.f.a.b.5.0.0.0.0.0.0.0.0.0.0.0.0.0.8.e.f.ip6.arpa. (90)
18:12:42.847648 IP 192.168.203.244.netbios-ns > 192.168.203.255.netbios-ns: UDP, length 68
18:12:42.847675 IP 192.168.203.244.netbios-ns > 192.168.203.255.netbios-ns: UDP, length 68
18:12:42.847676 IP 192.168.203.244.netbios-ns > 192.168.203.255.netbios-ns: UDP, length 68
18:12:42.947628 IP 192.168.202.207.mdns > mdns.mcast.net.mdns: 0*- [0q] 1/0/0 (Cache flush) TXT "name=Mos-com-10818" "uuid=f32c8e5d-6aa7-4d4f-92b8-e1ae9678aef4" "type=NoMachine" "port=0" "OS=Windows 11" "HW=LENOVO 21JNS0AY00" "mac=60:45:2e:b7:1b:9b" "service=nx:4000" "ip=10.15.61.52;192.168.202.207;192.168.137.1;fe80::16bc:6339:e948:d60e;fe80::f584:4c00:a8d1:9d37" (312)
18:12:42.947629 IP 192.168.202.207.mdns > mdns.mcast.net.mdns: 0*- [0q] 1/0/0 PTR Mos-com-10818._nomachine._tcp.local. (61)
18:12:43.050290 IP 192.168.202.51.34372 > 192.168.203.255.58581: UDP, length 128
18:12:43.050297 IP 192.168.202.67.36449 > 192.168.203.255.58581: UDP, length 140
18:12:43.152594 IP 192.168.202.71.netbios-ns > 192.168.203.255.netbios-ns: UDP, length 50
18:12:43.152596 IP 192.168.202.71.netbios-ns > 192.168.203.255.netbios-ns: UDP, length 50
18:12:43.152597 IP 192.168.202.131.mdns > mdns.mcast.net.mdns: 0 A (QM)? solsticediscoveryservice.local. (48)
18:12:43.152598 IP 192.168.202.131.mdns > mdns.mcast.net.mdns: 0 A (QM)? solsticediscoveryservice.local. (48)
18:12:43.254403 IP 192.168.202.217.49961 > 192.168.203.255.58581: UDP, length 125
18:12:43.447320 IP aravind-thinkpad-e15-gen-4.45242 > dns.google.domain: 64185+ [1au] PTR? 200.202.168.192.in-addr.arpa. (57)
18:12:43.461328 IP 192.168.202.67.36449 > 192.168.203.255.58581: UDP, length 140
18:12:43.465315 IP dns.google.domain > aravind-thinkpad-e15-gen-4.45242: 64185 NXDomain 0/0/1 (57)
18:12:43.465486 IP aravind-thinkpad-e15-gen-4.45242 > dns.google.domain: 64185+ PTR? 200.202.168.192.in-addr.arpa. (46)
18:12:43.481737 IP dns.google.domain > aravind-thinkpad-e15-gen-4.45242: 64185 NXDomain 0/0/0 (46)
18:12:43.485112 IP aravind-thinkpad-e15-gen-4.48875 > dns.google.domain: 15423+ [1au] PTR? 244.203.168.192.in-addr.arpa. (57)
18:12:43.500053 IP dns.google.domain > aravind-thinkpad-e15-gen-4.48875: 15423 NXDomain 0/0/1 (57)
18:12:43.500317 IP aravind-thinkpad-e15-gen-4.48875 > dns.google.domain: 15423+ PTR? 244.203.168.192.in-addr.arpa. (46)
18:12:43.515026 IP dns.google.domain > aravind-thinkpad-e15-gen-4.48875: 15423 NXDomain 0/0/0 (46)
18:12:43.515645 IP aravind-thinkpad-e15-gen-4.50108 > dns.google.domain: 55694+ [1au] PTR? c.b.4.f.4.2.3.4.0.3.b.0.5.f.c.0.0.0.0.0.0.0.0.0.0.0.0.0.0.8.e.f.ip6.arpa. (101)
18:12:43.551080 IP dns.google.domain > aravind-thinkpad-e15-gen-4.50108: 55694 NXDomain 0/1/1 (165)
18:12:43.551413 IP aravind-thinkpad-e15-gen-4.50108 > dns.google.domain: 55694+ PTR? c.b.4.f.4.2.3.4.0.3.b.0.5.f.c.0.0.0.0.0.0.0.0.0.0.0.0.0.0.8.e.f.ip6.arpa. (90)
18:12:43.568086 IP 192.168.203.167.1534 > 192.168.203.255.1534: UDP, length 8
18:12:43.568103 IP dns.google.domain > aravind-thinkpad-e15-gen-4.50108: 55694 NXDomain 0/1/0 (154)
18:12:43.568105 ARP, Request who-has 192.168.202.50 tell 192.168.202.71, length 46
18:12:43.568113 IP 192.168.202.51.34372 > 192.168.203.255.58581: UDP, length 128
18:12:43.673827 ARP, Request who-has 192.168.203.244 (Broadcast) tell _gateway, length 46
18:12:43.673832 IP 192.168.203.244.netbios-ns > 192.168.203.255.netbios-ns: UDP, length 68
18:12:43.767296 IP 192.168.202.217.49961 > 192.168.203.255.58581: UDP, length 125
18:12:43.798343 IP aravind-thinkpad-e15-gen-4.45126 > 40.126.17.132.https: Flags [.], ack 2629150527, win 501, length 0
18:12:43.815721 IP 40.126.17.132.https > aravind-thinkpad-e15-gen-4.45126: Flags [.], ack 1, win 16385, length 0
18:12:43.878515 IP6 fe80::6427:d338:3dab:b2dd.mdns > ff02::fb.mdns: 0 A (QM)? npic4b175.local. (33)
18:12:43.878517 IP6 fe80::6427:d338:3dab:b2dd.mdns > ff02::fb.mdns: 0 AAAA (QM)? npic4b175.local. (33)
18:12:43.972075 IP 192.168.202.155.mdns > mdns.mcast.net.mdns: 0*- [0q] 4/0/3 (Cache flush) PTR Android-9.local., (Cache flush) PTR Android-9.local., (Cache flush) A 192.168.202.155, (Cache flush) AAAA fe80::50c4:60ff:fe27:c075 (251)
18:12:43.972104 IP 192.168.202.253.36323 > 192.168.203.255.58581: UDP, length 115
18:12:44.073526 IP 192.168.202.51.34372 > 192.168.203.255.58581: UDP, length 128
18:12:44.176287 IP 192.168.202.131.mdns > mdns.mcast.net.mdns: 0 A (QM)? solsticediscoveryservice.local. (48)
18:12:44.176289 IP 192.168.202.131.mdns > mdns.mcast.net.mdns: 0 A (QM)? solsticedirectoryservice.local. (48)
18:12:44.278795 IP 192.168.202.71.netbios-ns > 192.168.203.255.netbios-ns: UDP, length 50
18:12:44.381726 IP 192.168.202.159.mdns > mdns.mcast.net.mdns: 12 [3q] PTR (QM)? _%9E5E7C8F47989526C9BCD95D24084F6F0B27C5ED._sub._googlecast._tcp.local. PTR (QM)? _CFE7FEDA._sub._googlecast._tcp.local. PTR (QM)? _googlecast._tcp.local. (110)
18:12:44.381730 IP 192.168.203.244.netbios-ns > 192.168.203.255.netbios-ns: UDP, length 68
18:12:44.471364 IP aravind-thinkpad-e15-gen-4.56173 > dns.google.domain: 14737+ [1au] PTR? 167.203.168.192.in-addr.arpa. (57)
18:12:44.493110 IP 192.168.202.67.36449 > 192.168.203.255.58581: UDP, length 140
18:12:44.493112 IP 192.168.202.253.36323 > 192.168.203.255.58581: UDP, length 115
18:12:44.591153 IP 192.168.202.51.34372 > 192.168.203.255.58581: UDP, length 128
18:12:44.591162 ARP, Request who-has _gateway tell 192.168.202.67, length 46
18:12:44.688584 IP 192.168.202.217.49961 > 192.168.203.255.58581: UDP, length 125
18:12:44.894428 IP6 fe80::7019:2eff:fe46:8605.mdns > ff02::fb.mdns: 2644 PTR (QM)? _spotify-social-listening._tcp.local. (54)
18:12:44.894429 IP6 fe80::7019:2eff:fe46:8605.mdns > ff02::fb.mdns: 1244 PTR (QM)? _spotify-social-listening._tcp.local. (54)
18:12:44.894444 IP6 fe80::6427:d338:3dab:b2dd.mdns > ff02::fb.mdns: 0 A (QM)? npic4b175.local. (33)
18:12:44.894444 IP6 fe80::6427:d338:3dab:b2dd.mdns > ff02::fb.mdns: 0 AAAA (QM)? npic4b175.local. (33)
18:12:44.998131 IP 192.168.202.128.mdns > mdns.mcast.net.mdns: 0 ANY (QM)? Thrinadh.local. (32)
18:12:44.998134 IP 192.168.202.128.mdns > mdns.mcast.net.mdns: 0*- [0q] 2/0/0 AAAA fe80::9c2:4f08:69aa:cc9d, A 192.168.202.128 (70)
18:12:44.998135 IP 192.168.202.51.34372 > 192.168.203.255.58581: UDP, length 128
18:12:45.098035 IP6 fe80::9a45:a22e:2b7e:250c.mdns > ff02::fb.mdns: 0 PTR (QU)? _microsoft_mcc._tcp.local. (43)
18:12:45.201046 IP 192.168.203.182.mdns > mdns.mcast.net.mdns: 0 PTR (QU)? _microsoft_mcc._tcp.local. (43)
18:12:45.201086 IP 192.168.202.217.49961 > 192.168.203.255.58581: UDP, length 125
18:12:45.303013 IP6 fe80::1ca8:20ff:fe50:2bc1.mdns > ff02::fb.mdns: 0*- [0q] 4/0/3 (Cache flush) PTR Android-4.local., (Cache flush) PTR Android-4.local., (Cache flush) A 192.168.203.85, (Cache flush) AAAA fe80::1ca8:20ff:fe50:2bc1 (250)
18:12:45.303017 IP 192.168.202.234.mdns > mdns.mcast.net.mdns: 0 PTR (QU)? c.0.5.2.e.7.b.2.e.2.2.a.5.4.a.9.0.0.0.0.0.0.0.0.0.0.0.0.0.8.e.f.ip6.arpa. (90)
18:12:45.404714 IP 192.168.202.234.mdns > mdns.mcast.net.mdns: 0 PTR (QU)? 7.a.4.e.1.6.8.1.4.f.0.9.6.8.9.a.0.0.0.0.0.0.0.0.0.0.0.0.0.8.e.f.ip6.arpa. (90)
18:12:45.404818 IP6 fe80::cf5:b30:4324:f4bc.mdns > ff02::fb.mdns: 0 PTR (QU)? 7.a.4.e.1.6.8.1.4.f.0.9.6.8.9.a.0.0.0.0.0.0.0.0.0.0.0.0.0.8.e.f.ip6.arpa. (90)
18:12:45.507989 IP 192.168.202.51.34372 > 192.168.203.255.58581: UDP, length 128
18:12:45.529421 IP aravind-thinkpad-e15-gen-4.36658 > 162.247.243.29.https: Flags [P.], seq 275344875:275346185, ack 470349326, win 501, options [nop,nop,TS val 872963977 ecr 4013399776], length 1310
18:12:45.535923 IP 162.247.243.29.https > aravind-thinkpad-e15-gen-4.36658: Flags [.], ack 1310, win 295, options [nop,nop,TS val 4013409642 ecr 872963977], length 0
18:12:45.712914 IP 192.168.202.217.49961 > 192.168.203.255.58581: UDP, length 125
18:12:45.816599 IP 162.247.243.29.https > aravind-thinkpad-e15-gen-4.36658: Flags [P.], seq 1:387, ack 1310, win 295, options [nop,nop,TS val 4013409898 ecr 872963977], length 386
18:12:45.816647 IP 192.168.202.71.netbios-ns > 192.168.203.255.netbios-ns: UDP, length 50
18:12:45.816658 IP aravind-thinkpad-e15-gen-4.36658 > 162.247.243.29.https: Flags [.], ack 387, win 501, options [nop,nop,TS val 872964264 ecr 4013409898], length 0
18:12:45.918470 ARP, Request who-has 192.168.203.244 tell 192.168.203.244, length 46
18:12:46.019849 IP 192.168.202.202.mdns > mdns.mcast.net.mdns: 42 [5q] PTR (QM)? _%9E5E7C8F47989526C9BCD95D24084F6F0B27C5ED._sub._googlecast._tcp.local. PTR (QM)? _CFE7FEDA._sub._googlecast._tcp.local. PTR (QM)? _233637DE._sub._googlecast._tcp.local. PTR (QM)? _44ED731B._sub._googlecast._tcp.local. PTR (QM)? _googlecast._tcp.local. (142)
18:12:46.019863 IP 192.168.202.51.34372 > 192.168.203.255.58581: UDP, length 128
18:12:46.102463 IP aravind-thinkpad-e15-gen-4.47516 > 162.247.243.29.https: Flags [.], seq 2280089884:2280091292, ack 2571132725, win 501, options [nop,nop,TS val 872964550 ecr 803575035], length 1408
18:12:46.131305 IP 192.168.203.225.mdns > mdns.mcast.net.mdns: 0 PTR (QM)? _microsoft_mcc._tcp.local. (43)
18:12:46.131330 IP6 fe80::9a45:a22e:2b7e:250c.mdns > ff02::fb.mdns: 0 PTR (QM)? _microsoft_mcc._tcp.local. (43)
18:12:46.224350 IP 192.168.203.182.mdns > mdns.mcast.net.mdns: 0 PTR (QM)? _microsoft_mcc._tcp.local. (43)
18:12:46.224395 IP 192.168.202.217.49961 > 192.168.203.255.58581: UDP, length 125
18:12:46.326272 ARP, Request who-has _gateway tell 192.168.202.51, length 46
18:12:46.428905 IP 192.168.202.67.36449 > 192.168.203.255.58581: UDP, length 140
18:12:46.531359 IP 192.168.202.51.34372 > 192.168.203.255.58581: UDP, length 128
18:12:46.531474 ARP, Request who-has 192.168.202.124 tell 192.168.202.5, length 46
18:12:46.633625 ARP, Request who-has _gateway tell 192.168.202.67, length 46
18:12:46.735924 IP 192.168.202.217.49961 > 192.168.203.255.58581: UDP, length 125
18:12:46.940939 IP 192.168.202.67.36449 > 192.168.203.255.58581: UDP, length 140
18:12:47.043511 IP 192.168.202.253.36323 > 192.168.203.255.58581: UDP, length 115
18:12:47.043527 IP 192.168.202.51.34372 > 192.168.203.255.58581: UDP, length 128
18:12:47.147473 IP6 fe80::dc92:693f:2289:28ad.mdns > ff02::fb.mdns: 0 ANY (QM)? Mos-Com-11371.local. (37)
18:12:47.147475 IP6 fe80::dc92:693f:2289:28ad.mdns > ff02::fb.mdns: 0*- [0q] 2/0/0 AAAA fe80::dc92:693f:2289:28ad, A 192.168.203.192 (75)
18:12:47.248160 IP 192.168.202.217.49961 > 192.168.203.255.58581: UDP, length 125
18:12:47.350543 IP6 fe80::cf5:b30:4324:f4bc.mdns > ff02::fb.mdns: 0 PTR (QU)? d.a.8.2.9.8.2.2.f.3.9.6.2.9.c.d.0.0.0.0.0.0.0.0.0.0.0.0.0.8.e.f.ip6.arpa. (90)
18:12:47.453170 IP 192.168.202.67.36449 > 192.168.203.255.58581: UDP, length 140
18:12:47.555263 IP 192.168.202.51.34372 > 192.168.203.255.58581: UDP, length 128
18:12:47.759968 IP 192.168.202.217.49961 > 192.168.203.255.58581: UDP, length 125
18:12:47.862282 ARP, Request who-has 192.168.203.244 tell 192.168.203.244, length 46
18:12:47.965037 IP6 fe80::7019:2eff:fe46:8605.mdns > ff02::fb.mdns: 861 PTR (QM)? _spotify-social-listening._tcp.local. (54)
18:12:48.067370 IP 192.168.202.253.36323 > 192.168.203.255.58581: UDP, length 115
18:12:48.067380 IP 192.168.202.51.34372 > 192.168.203.255.58581: UDP, length 128
18:12:48.272063 ARP, Request who-has _gateway tell 192.168.202.51, length 46
18:12:48.374427 IP6 fe80::cf5:b30:4324:f4bc.mdns > ff02::fb.mdns: 0 PTR (QM)? d.a.8.2.9.8.2.2.f.3.9.6.2.9.c.d.0.0.0.0.0.0.0.0.0.0.0.0.0.8.e.f.ip6.arpa. (90)
18:12:48.477073 IP 192.168.202.67.36449 > 192.168.203.255.58581: UDP, length 140
18:12:48.477077 IP 192.168.202.253.36323 > 192.168.203.255.58581: UDP, length 115
18:12:48.579749 ARP, Request who-has _gateway tell 192.168.202.67, length 46
18:12:48.579751 ARP, Request who-has 192.168.202.83 tell 192.168.203.63, length 28
18:12:48.682210 IP6 fe80::7019:2eff:fe46:8605.mdns > ff02::fb.mdns: 520 PTR (QM)? _spotify-social-listening._tcp.local. (54)
18:12:48.682213 IP 192.168.202.198.netbios-dgm > 192.168.203.255.netbios-dgm: UDP, length 213
18:12:48.785010 IP 192.168.202.198.netbios-dgm > 192.168.203.255.netbios-dgm: UDP, length 213
18:12:48.989163 IP 192.168.202.67.36449 > 192.168.203.255.58581: UDP, length 140
18:12:48.989166 IP 192.168.202.253.36323 > 192.168.203.255.58581: UDP, length 115
18:12:49.091669 IP 192.168.202.80.netbios-dgm > 192.168.203.255.netbios-dgm: UDP, length 227
18:12:49.193907 IP 192.168.203.22.mdns > mdns.mcast.net.mdns: 33 [3q] PTR (QM)? _%9E5E7C8F47989526C9BCD95D24084F6F0B27C5ED._sub._googlecast._tcp.local. PTR (QM)? _CFE7FEDA._sub._googlecast._tcp.local. PTR (QM)? _googlecast._tcp.local. (110)
18:12:49.193918 IP 192.168.202.217.49961 > 192.168.203.255.58581: UDP, length 125
18:12:49.476678 IP aravind-thinkpad-e15-gen-4.56173 > dns.google.domain: 14737+ [1au] PTR? 167.203.168.192.in-addr.arpa. (57)
18:12:49.492022 IP dns.google.domain > aravind-thinkpad-e15-gen-4.56173: 14737 NXDomain 0/0/1 (57)
18:12:49.492406 IP aravind-thinkpad-e15-gen-4.56173 > dns.google.domain: 14737+ PTR? 167.203.168.192.in-addr.arpa. (46)
18:12:49.505563 IP 192.168.202.138.mdns > mdns.mcast.net.mdns: 0 A (QM)? WIN-DMD7GGVAOEU.local. (39)
18:12:49.505566 IP 192.168.202.138.mdns > mdns.mcast.net.mdns: 0 AAAA (QM)? WIN-DMD7GGVAOEU.local. (39)
18:12:49.505650 IP 192.168.202.77.mdns > mdns.mcast.net.mdns: 0 ANY (QM)? Mos-Com-10556.local. (37)
18:12:49.505650 IP 192.168.202.77.mdns > mdns.mcast.net.mdns: 0*- [0q] 2/0/0 AAAA fe80::30d:9edb:411d:582b, A 192.168.202.77 (75)
18:12:49.505651 IP 192.168.202.77.mdns > mdns.mcast.net.mdns: 0 ANY (QM)? Mos-Com-10556.local. (37)
18:12:49.505652 IP 192.168.202.77.mdns > mdns.mcast.net.mdns: 0*- [0q] 2/0/0 AAAA fe80::30d:9edb:411d:582b, A 192.168.202.77 (75)
18:12:49.505653 IP dns.google.domain > aravind-thinkpad-e15-gen-4.56173: 14737 NXDomain 0/0/0 (46)
18:12:49.507533 IP aravind-thinkpad-e15-gen-4.35395 > dns.google.domain: 35727+ [1au] PTR? 132.17.126.40.in-addr.arpa. (55)
18:12:49.541803 IP dns.google.domain > aravind-thinkpad-e15-gen-4.35395: 35727 NXDomain 0/1/1 (141)
18:12:49.542160 IP aravind-thinkpad-e15-gen-4.35395 > dns.google.domain: 35727+ PTR? 132.17.126.40.in-addr.arpa. (44)
18:12:49.557126 IP dns.google.domain > aravind-thinkpad-e15-gen-4.35395: 35727 NXDomain 0/1/0 (130)
18:12:49.558742 IP aravind-thinkpad-e15-gen-4.39703 > dns.google.domain: 61778+ [1au] PTR? 155.202.168.192.in-addr.arpa. (57)
18:12:49.573206 IP dns.google.domain > aravind-thinkpad-e15-gen-4.39703: 61778 NXDomain 0/0/1 (57)
18:12:49.573322 IP aravind-thinkpad-e15-gen-4.39703 > dns.google.domain: 61778+ PTR? 155.202.168.192.in-addr.arpa. (46)
18:12:49.587253 IP dns.google.domain > aravind-thinkpad-e15-gen-4.39703: 61778 NXDomain 0/0/0 (46)
18:12:49.588159 IP aravind-thinkpad-e15-gen-4.37397 > dns.google.domain: 40510+ [1au] PTR? 159.202.168.192.in-addr.arpa. (57)
18:12:49.604900 IP dns.google.domain > aravind-thinkpad-e15-gen-4.37397: 40510 NXDomain 0/0/1 (57)
18:12:49.604906 IP 192.168.202.51.34372 > 192.168.203.255.58581: UDP, length 128
18:12:49.605137 IP aravind-thinkpad-e15-gen-4.37397 > dns.google.domain: 40510+ PTR? 159.202.168.192.in-addr.arpa. (46)
18:12:49.620142 IP dns.google.domain > aravind-thinkpad-e15-gen-4.37397: 40510 NXDomain 0/0/0 (46)
18:12:49.621776 IP aravind-thinkpad-e15-gen-4.37348 > dns.google.domain: 53056+ [1au] PTR? 128.202.168.192.in-addr.arpa. (57)
18:12:49.637411 IP dns.google.domain > aravind-thinkpad-e15-gen-4.37348: 53056 NXDomain 0/0/1 (57)
18:12:49.637689 IP aravind-thinkpad-e15-gen-4.37348 > dns.google.domain: 53056+ PTR? 128.202.168.192.in-addr.arpa. (46)
18:12:49.653442 IP dns.google.domain > aravind-thinkpad-e15-gen-4.37348: 53056 NXDomain 0/0/0 (46)
18:12:49.654825 IP aravind-thinkpad-e15-gen-4.41585 > dns.google.domain: 35410+ [1au] PTR? c.0.5.2.e.7.b.2.e.2.2.a.5.4.a.9.0.0.0.0.0.0.0.0.0.0.0.0.0.8.e.f.ip6.arpa. (101)
18:12:49.688183 IP dns.google.domain > aravind-thinkpad-e15-gen-4.41585: 35410 NXDomain 0/1/1 (165)
18:12:49.688584 IP aravind-thinkpad-e15-gen-4.41585 > dns.google.domain: 35410+ PTR? c.0.5.2.e.7.b.2.e.2.2.a.5.4.a.9.0.0.0.0.0.0.0.0.0.0.0.0.0.8.e.f.ip6.arpa. (90)
18:12:49.703832 IP dns.google.domain > aravind-thinkpad-e15-gen-4.41585: 35410 NXDomain 0/1/0 (154)
18:12:49.705322 IP aravind-thinkpad-e15-gen-4.38384 > dns.google.domain: 25046+ [1au] PTR? 182.203.168.192.in-addr.arpa. (57)
18:12:49.705561 IP 192.168.202.234.mdns > mdns.mcast.net.mdns: 0 PTR (QU)? b.2.8.5.d.1.1.4.b.d.e.9.d.0.3.0.0.0.0.0.0.0.0.0.0.0.0.0.0.8.e.f.ip6.arpa. (90)
18:12:49.705612 IP6 fe80::cf5:b30:4324:f4bc.mdns > ff02::fb.mdns: 0 PTR (QU)? b.2.8.5.d.1.1.4.b.d.e.9.d.0.3.0.0.0.0.0.0.0.0.0.0.0.0.0.0.8.e.f.ip6.arpa. (90)
18:12:49.706844 IP 192.168.202.217.49961 > 192.168.203.255.58581: UDP, length 125
18:12:49.725887 IP dns.google.domain > aravind-thinkpad-e15-gen-4.38384: 25046 NXDomain 0/0/1 (57)
18:12:49.726153 IP aravind-thinkpad-e15-gen-4.38384 > dns.google.domain: 25046+ PTR? 182.203.168.192.in-addr.arpa. (46)
18:12:49.744816 IP dns.google.domain > aravind-thinkpad-e15-gen-4.38384: 25046 NXDomain 0/0/0 (46)
18:12:49.745751 IP aravind-thinkpad-e15-gen-4.44255 > dns.google.domain: 34955+ [1au] PTR? 1.c.b.2.0.5.e.f.f.f.0.2.8.a.c.1.0.0.0.0.0.0.0.0.0.0.0.0.0.8.e.f.ip6.arpa. (101)
18:12:49.778048 IP dns.google.domain > aravind-thinkpad-e15-gen-4.44255: 34955 NXDomain 0/1/1 (165)
